{
  "$schema": "https://json-schema.org/draft/2020-12/schema",
  "$id": "https://kagra.dev/schemas/world.json",
  "title": "KAGRA World dump",
  "description": "JSON from World.dump() / World.load(), ingested by kagra-shared WorldDoc (not Scene3D). Scene3D is a one-frame draw list; WorldDoc::compile_scene builds it (heightfield batches from named fn or samples, glTF via gltf_load, sprite/quad XY cards, torus rings, capsule player, metal coins, lights slot=0..3). Prop pitch/roll and local parent TRS (up to 4 links) are picture-only; position stays world-space unless local is true. WorldPlay ticks title→play→result (WASD, pick up, count, finish). render_world_doc (shared wgpu 30 offscreen) draws that frame to RGBA. python -m kagra.play_world is the official Crest collectathon window. Stable string ids, not GPU mesh integers. Live Python height_fn cannot dump; named demo fn or samples. RendererV2 stays for leftover VRM demos only.",
  "type": "object",
  "required": ["version"],
  "properties": {
    "version": { "const": 1 },
    "genre": {
      "type": ["string", "null"],
      "description": "Explicit genre id (crest_isle, fish_cast, town_gate, …). Omit = free world: walk / camera / interact / timers / events only. Prop names are never reserved."
    },
    "half": { "type": "number" },
    "floor_y": { "type": "number" },
    "gravity": { "type": "number" },
    "water_y": { "type": ["number", "null"] },
    "coins": { "type": "integer", "minimum": 0 },
    "player": { "$ref": "#/$defs/walker" },
    "props": {
      "type": "array",
      "items": { "$ref": "#/$defs/prop" }
    },
    "walkers": {
      "type": "array",
      "items": { "$ref": "#/$defs/walker" }
    },
    "lights": {
      "type": "array",
      "items": { "$ref": "#/$defs/light" }
    },
    "cameras": {
      "type": "array",
      "items": { "$ref": "#/$defs/camera" }
    },
    "heightfield": {
      "oneOf": [
        { "type": "null" },
        { "$ref": "#/$defs/heightfield" }
      ]
    },
    "ibl": {
      "type": ["number", "null"],
      "description": "Diffuse IBL strength. Omit = 0.35 (outdoor). 0 = off. Shared wgpu 30 shader Globals.env.x; not a 4K HDR cubemap."
    },
    "exposure": {
      "type": ["number", "null"],
      "description": "Linear exposure. Omit = 1.0. Globals.env.y."
    },
    "tonemap": {
      "type": ["boolean", "null"],
      "description": "ACES tonemap. Omit = on. Globals.env.w. Reinhard is not used; ACES matches kagra-core V2."
    },
    "bloom": {
      "type": ["number", "null"],
      "description": "Bloom intensity on render_world_doc. Omit = 0. The desktop window example keeps its own default."
    },
    "bloom_threshold": {
      "type": ["number", "null"],
      "description": "Bloom extract threshold. Omit = 0.85."
    },
    "vignette": {
      "type": ["number", "null"],
      "description": "Vignette strength. Omit = 1 (the historical curve). 0 = off. Above 1 darkens the corners further."
    },
    "lut": {
      "type": ["string", "null"],
      "description": "Display LUT preset after ACES: off, warm, punch, cool. Omit = off. A 16^3 strip, texture_2d, WebGL2 safe."
    },
    "lut_strength": {
      "type": ["number", "null"],
      "description": "Mix toward the LUT, 0..1. Omit = 1 when lut is set."
    },
    "fxaa": {
      "type": ["boolean", "null"],
      "description": "FXAA on the composite. Omit = on."
    },
    "sky": {
      "type": ["array", "null"],
      "minItems": 4,
      "maxItems": 4,
      "items": { "type": "integer", "minimum": 0, "maximum": 255 },
      "description": "Clear + fog RGBA. Omit = outdoor [130, 165, 205, 255]. Indoor rooms dump a dark color."
    },
    "ground": {
      "type": ["boolean", "null"],
      "description": "Auto grass plane when there is no heightfield. Omit = true. Indoor rooms dump false and place their own floor."
    },
    "timers": {
      "type": "array",
      "description": "Generic countdowns. WorldPlay::start_timer / tick_timers. On 0, on_done is emitted as an event and active flips false. Cooking wait, fishing cast→bite, cooldowns.",
      "items": { "$ref": "#/$defs/timer" }
    },
    "events": {
      "type": "array",
      "description": "Named happenings. WorldPlay::emit_event aggregates by name; take_events consumes. Multiple systems (score, UI, save) read the same event from the dump — no callback bus.",
      "items": { "$ref": "#/$defs/event" }
    },
    "joints": {
      "type": "array",
      "description": "Rapier impulse joints (physics feature). name is fixed / revolute / spherical. Anchors are body-local. Omit when empty.",
      "items": { "$ref": "#/$defs/joint" }
    }
  },
  "$defs": {
    "vec3": {
      "type": "array",
      "minItems": 3,
      "maxItems": 3,
      "items": { "type": "number" }
    },
    "prop": {
      "type": "object",
      "required": ["id", "type"],
      "properties": {
        "id": { "type": "string", "description": "Stable string id, e.g. prop:1" },
        "type": { "const": "prop" },
        "name": { "type": "string" },
        "position": { "$ref": "#/$defs/vec3" },
        "yaw": { "type": "number" },
        "pitch": {
          "type": "number",
          "description": "Nose up, radians. Omit = 0. Intrinsic Y (yaw), X (pitch), Z (roll)."
        },
        "roll": {
          "type": "number",
          "description": "Bank, radians. Positive lifts local +X. Omit = 0."
        },
        "model": {
          "type": "string",
          "description": "box/sphere/capsule/plane/sprite/quad/torus/ring. torus|ring is an XY ring (hole along +Z). sprite|quad is a standing XY card. name target = FPS range hitscan (look + fire + hit). name tower + waypoint + creep = TD lane (path walk, tower hit, leak/clear). name finish + split = race drive (steer+throttle, lap/finish). name opponent = fight round (J/click attack, hitstun, KO)."
        },
        "gltf": { "type": ["string", "null"] },
        "texture": {
          "type": ["string", "null"],
          "description": "Repo-relative PNG path. compile_meshes attaches albedo on box/plane/sprite/quad. Alpha < 0.5 is discarded."
        },
        "uv_scale": {
          "type": ["array", "null"],
          "minItems": 2,
          "maxItems": 2,
          "items": { "type": "number" },
          "description": "Repeat the albedo this many times (CPU tile; sampler stays ClampToEdge). Omit = [1, 1]."
        },
        "scale": {
          "type": "array",
          "minItems": 3,
          "maxItems": 3,
          "items": { "type": "number" }
        },
        "enabled": { "type": "boolean" },
        "parent": {
          "type": ["string", "null"],
          "description": "Parent prop id. With local=true, position/yaw/pitch/roll/scale are parent-space (up to 4 links). Without local, parent is a link only and position stays world-space."
        },
        "local": {
          "type": "boolean",
          "description": "True = TRS is in parent space. Omit = false (world space), so existing parent links do not move."
        },
        "color": {
          "type": "array",
          "minItems": 3,
          "maxItems": 3,
          "items": { "type": "integer" }
        },
        "metallic": {
          "type": "number",
          "minimum": 0,
          "maximum": 1,
          "description": "Coins dump 1.0. Shared compile_scene uses Material::Metal."
        },
        "roughness": {
          "type": "number",
          "minimum": 0,
          "maximum": 1,
          "description": "Coins dump 0.12 (GGX). Default 1."
        },
        "interact": {
          "$ref": "#/$defs/interact",
          "description": "Interaction metadata (talk / use / examine). None = plain scenery. on_use emits an event when the player presses J/attack in reach."
        },
        "body": {
          "type": ["string", "null"],
          "description": "Rapier body: static / dynamic / kinematic. Omit = is_static (default static)."
        },
        "collider": {
          "type": ["string", "null"],
          "description": "box / sphere / capsule / cylinder / cone / none. Omit = infer from model."
        },
        "sensor": {
          "type": "boolean",
          "description": "True = overlap events only. Omit = false."
        },
        "mass": {
          "type": "number",
          "minimum": 0,
          "description": "Dynamic mass in kg. Omit or 0 = collider density."
        }
      }
    },
    "joint": {
      "type": "object",
      "properties": {
        "id": { "type": "string" },
        "type": { "type": "string", "description": "joint, or the joint name if name is empty." },
        "name": { "type": "string", "description": "fixed / revolute / spherical" },
        "body_a": { "type": "string" },
        "body_b": { "type": "string" },
        "anchor_a": { "$ref": "#/$defs/vec3" },
        "anchor_b": { "$ref": "#/$defs/vec3" },
        "axis": { "$ref": "#/$defs/vec3", "description": "Revolute axis, local. Default +Y." }
      }
    },
    "interact": {
      "type": "object",
      "properties": {
        "kind": {
          "type": "string",
          "description": "talk | use | examine. HUD glyph/color can key off this."
        },
        "prompt": {
          "type": "string",
          "description": "Short HUD label while in reach (水辺, cast)."
        },
        "on_use": {
          "type": ["string", "null"],
          "description": "Event name emitted when used (e.g. cast). WorldPlay::step_interact emits it with {prop, name} payload."
        },
        "reach": {
          "type": "number",
          "minimum": 0,
          "description": "Horizontal reach in world units. Default 2.5."
        }
      }
    },
    "timer": {
      "type": "object",
      "required": ["id", "type"],
      "properties": {
        "id": { "type": "string", "description": "e.g. timer:cast" },
        "type": { "const": "timer" },
        "name": { "type": "string", "description": "e.g. cast / cook / cooldown" },
        "seconds": { "type": "number", "minimum": 0, "description": "Total seconds." },
        "remaining": { "type": "number", "minimum": 0, "description": "Remaining seconds. WorldPlay::tick_timers counts down while active." },
        "on_done": {
          "type": ["string", "null"],
          "description": "Event name emitted when the countdown completes (e.g. bite)."
        },
        "active": {
          "type": "boolean",
          "description": "False = parked. A game starts it via start_timer / the use event."
        }
      }
    },
    "event": {
      "type": "object",
      "required": ["id", "type"],
      "properties": {
        "id": { "type": "string", "description": "e.g. event:0" },
        "type": { "const": "event" },
        "name": { "type": "string", "description": "e.g. fish_caught / cast / bite" },
        "count": {
          "type": "integer",
          "minimum": 1,
          "description": "Aggregated occurrences (two fish = count 2)."
        },
        "data": {
          "type": ["object", "null"],
          "description": "Optional payload (which prop, which fish)."
        }
      }
    },
    "walker": {
      "type": "object",
      "required": ["id", "type"],
      "properties": {
        "id": { "type": "string", "description": "e.g. walker:player" },
        "type": { "const": "walker" },
        "name": { "type": "string" },
        "position": { "$ref": "#/$defs/vec3" },
        "yaw": { "type": "number" },
        "face": { "type": "number" },
        "on_ground": { "type": "boolean" },
        "model": {
          "type": "string",
          "description": "Same dump key as prop.model. Capsule fallback when no glTF."
        },
        "gltf": {
          "type": ["string", "null"],
          "description": "Same dump key as prop.gltf. Skinned glTF 2.0 / .glb / .vrm (glTF-binary + VRM 0/1 extras). CPU-skinned into Vertex3 on play_world. Capsule if missing."
        },
        "clip": {
          "type": "number",
          "description": "Seconds into the walk clip. 0 = rest / T-pose. Advances while WASD walking."
        },
        "anim": {
          "type": "string",
          "description": "Current animation state: idle / walk (engine-derived from wish) or a genre-set name (cast, reel, hit) that survives while standing. Dump-visible so the game state machine reads it without an engine hook."
        },
        "expression": {
          "type": "string",
          "description": "Selected VRM expression preset: blink (auto) / smile / angry / sad / joy / aa / ih / ou / ee / oh / custom. Dump-visible; games flip it via events / interact."
        },
        "scale": {
          "type": ["array", "null"],
          "minItems": 3,
          "maxItems": 3,
          "items": { "type": "number" },
          "description": "Draw scale. Omit = (1, 1, 1). Squash and stretch write this on the picture dump. The walker sim does not read it."
        }
      }
    },
    "light": {
      "type": "object",
      "required": ["id", "type"],
      "properties": {
        "id": { "type": "string", "description": "e.g. light:0" },
        "type": { "const": "light" },
        "name": { "type": "string" },
        "position": { "$ref": "#/$defs/vec3" },
        "kind": { "type": "string", "enum": ["point", "spot"] },
        "slot": { "type": "integer", "minimum": 0, "maximum": 3 },
        "intensity": { "type": "number" },
        "radius": { "type": "number" },
        "color": {
          "type": "array",
          "minItems": 3,
          "maxItems": 3,
          "items": { "type": "number" }
        },
        "direction": {
          "oneOf": [
            { "type": "null" },
            { "$ref": "#/$defs/vec3" }
          ]
        }
      }
    },
    "camera": {
      "type": "object",
      "required": ["id", "type"],
      "properties": {
        "id": { "type": "string", "description": "e.g. camera:main" },
        "type": { "const": "camera" },
        "name": { "type": "string" },
        "position": { "$ref": "#/$defs/vec3" },
        "target": { "$ref": "#/$defs/vec3" },
        "fov": { "type": "number" }
      }
    },
    "terrain_tile": {
      "type": "object",
      "required": ["id"],
      "properties": {
        "id": { "type": "string", "description": "e.g. tile:0,0" },
        "type": { "const": "terrain_tile" },
        "name": { "type": "string" },
        "ix": { "type": "integer" },
        "iz": { "type": "integer" },
        "position": { "$ref": "#/$defs/vec3" },
        "loaded": { "type": "boolean" },
        "has_mesh": { "type": "boolean" },
        "albedo_ok": {
          "type": "boolean",
          "description": "False when a leftover loaded tile has missing/1x1 albedo or no mesh while GPU tex is set (bald leftover)."
        }
      }
    },
    "heightfield": {
      "type": "object",
      "properties": {
        "fn": {
          "type": ["string", "null"],
          "description": "Named demo height_fn: island_height / overworld_height / open_world_height. Live Python fn cannot dump."
        },
        "tile": { "type": ["number", "null"] },
        "stream_radius": { "type": ["number", "null"] },
        "cells": { "type": ["integer", "null"] },
        "lod_radius": { "type": ["number", "null"] },
        "lod_cells": { "type": ["integer", "null"] },
        "uv": {
          "type": "object",
          "properties": {
            "half": { "type": ["number", "null"] },
            "period": { "type": ["number", "null"] },
            "blend": { "type": "number" },
            "pad": { "type": "number" },
            "rect": {
              "oneOf": [
                { "type": "null" },
                {
                  "type": "array",
                  "minItems": 4,
                  "maxItems": 4,
                  "items": { "type": "number" }
                }
              ]
            }
          }
        },
        "tiles": {
          "type": "array",
          "items": { "$ref": "#/$defs/terrain_tile" }
        },
        "samples": {
          "type": "array",
          "items": {
            "type": "array",
            "minItems": 3,
            "maxItems": 3,
            "items": { "type": "number" },
            "description": "[x, z, y]"
          }
        }
      }
    }
  }
}
