{
  "version": 1,
  "half": 12.0,
  "floor_y": 0.0,
  "gravity": 9.8,
  "water_y": null,
  "coins": 0,
  "player": {
    "id": "walker:player",
    "type": "walker",
    "name": "player",
    "position": [
      -2.2,
      0.95,
      0.0
    ],
    "yaw": 1.5707964,
    "face": 1.5707964,
    "on_ground": true
  },
  "props": [
    {
      "id": "prop:floor",
      "type": "prop",
      "name": "floor",
      "position": [
        0.0,
        -0.05,
        0.0
      ],
      "yaw": 0.0,
      "model": "box",
      "gltf": null,
      "scale": [
        18.0,
        0.1,
        8.0
      ],
      "enabled": true,
      "parent": null,
      "color": [
        86,
        58,
        54
      ]
    },
    {
      "id": "prop:ring",
      "type": "prop",
      "name": "ring",
      "position": [
        0.0,
        0.02,
        0.0
      ],
      "yaw": 0.0,
      "model": "box",
      "gltf": null,
      "scale": [
        10.0,
        0.04,
        4.4
      ],
      "enabled": true,
      "parent": null,
      "color": [
        140,
        92,
        72
      ]
    },
    {
      "id": "prop:post-l",
      "type": "prop",
      "name": "post",
      "position": [
        -5.2,
        0.7,
        -2.1
      ],
      "yaw": 0.0,
      "model": "box",
      "gltf": null,
      "scale": [
        0.28,
        1.4,
        0.28
      ],
      "enabled": true,
      "parent": null,
      "color": [
        210,
        188,
        120
      ]
    },
    {
      "id": "prop:post-r",
      "type": "prop",
      "name": "post",
      "position": [
        5.2,
        0.7,
        -2.1
      ],
      "yaw": 0.0,
      "model": "box",
      "gltf": null,
      "scale": [
        0.28,
        1.4,
        0.28
      ],
      "enabled": true,
      "parent": null,
      "color": [
        210,
        188,
        120
      ]
    },
    {
      "id": "prop:opponent",
      "type": "prop",
      "name": "opponent",
      "position": [
        2.2,
        0.95,
        0.0
      ],
      "yaw": -1.5707964,
      "model": "capsule",
      "gltf": null,
      "scale": [
        1.0,
        1.0,
        1.0
      ],
      "enabled": true,
      "parent": null,
      "color": [
        200,
        64,
        72
      ]
    }
  ],
  "walkers": [
    {
      "id": "walker:player",
      "type": "walker",
      "name": "player",
      "position": [
        -2.2,
        0.95,
        0.0
      ],
      "yaw": 1.5707964,
      "face": 1.5707964,
      "on_ground": true
    }
  ],
  "lights": [
    {
      "id": "light:0",
      "type": "light",
      "name": "key",
      "position": [
        4.0,
        9.0,
        6.0
      ],
      "kind": "point",
      "slot": 0,
      "intensity": 1.15,
      "radius": 26.0,
      "color": [
        1.0,
        0.92,
        0.82
      ],
      "direction": null
    },
    {
      "id": "light:1",
      "type": "light",
      "name": "fill",
      "position": [
        -6.0,
        6.0,
        4.0
      ],
      "kind": "point",
      "slot": 1,
      "intensity": 0.45,
      "radius": 20.0,
      "color": [
        0.55,
        0.68,
        1.0
      ],
      "direction": null
    },
    {
      "id": "light:2",
      "type": "light",
      "name": "rim",
      "position": [
        0.0,
        5.0,
        -6.0
      ],
      "kind": "point",
      "slot": 2,
      "intensity": 0.38,
      "radius": 18.0,
      "color": [
        1.0,
        0.7,
        0.55
      ],
      "direction": null
    },
    {
      "id": "light:3",
      "type": "light",
      "name": "bounce",
      "position": [
        0.0,
        3.5,
        0.0
      ],
      "kind": "point",
      "slot": 3,
      "intensity": 0.28,
      "radius": 14.0,
      "color": [
        0.9,
        0.78,
        0.7
      ],
      "direction": null
    }
  ],
  "cameras": [
    {
      "id": "camera:main",
      "type": "camera",
      "name": "dual",
      "position": [
        0.0,
        4.4,
        12.5
      ],
      "target": [
        0.0,
        1.15,
        0.0
      ],
      "fov": 48.0
    }
  ],
  "heightfield": null,
  "genre": "fight_hitstun"
}
