{
  "version": 1,
  "genre": "stealth_hide",
  "half": 14.0,
  "floor_y": 0.0,
  "gravity": 9.8,
  "water_y": null,
  "coins": 0,
  "ground": false,
  "sky": [16, 22, 30, 255],
  "ibl": 0.42,
  "exposure": 1.08,
  "player": {
    "id": "walker:player",
    "type": "walker",
    "name": "player",
    "position": [0.2, 0.95, 5.5],
    "yaw": 3.14,
    "face": 3.14,
    "on_ground": true,
    "model": "rogue",
    "gltf": "rogue"
  },
  "props": [
    {
      "id": "prop:floor",
      "type": "prop",
      "name": "floor",
      "position": [0.0, -0.06, 0.0],
      "yaw": 0.0,
      "model": "box",
      "scale": [16.4, 0.12, 16.4],
      "enabled": true,
      "color": [46, 52, 48],
      "roughness": 0.92
    },
    {
      "id": "prop:wall-n",
      "type": "prop",
      "name": "wall",
      "position": [0.0, 1.2, -7.2],
      "yaw": 0.0,
      "model": "box",
      "scale": [16.2, 2.4, 0.4],
      "enabled": true,
      "color": [72, 70, 64],
      "roughness": 0.88
    },
    {
      "id": "prop:wall-s",
      "type": "prop",
      "name": "wall",
      "position": [0.0, 1.2, 7.2],
      "yaw": 0.0,
      "model": "box",
      "scale": [16.2, 2.4, 0.4],
      "enabled": true,
      "color": [72, 70, 64],
      "roughness": 0.88
    },
    {
      "id": "prop:wall-w",
      "type": "prop",
      "name": "wall",
      "position": [-7.2, 1.2, 0.0],
      "yaw": 0.0,
      "model": "box",
      "scale": [0.4, 2.4, 16.2],
      "enabled": true,
      "color": [68, 66, 60],
      "roughness": 0.88
    },
    {
      "id": "prop:wall-e",
      "type": "prop",
      "name": "wall",
      "position": [7.2, 1.2, 0.0],
      "yaw": 0.0,
      "model": "box",
      "scale": [0.4, 2.4, 16.2],
      "enabled": true,
      "color": [68, 66, 60],
      "roughness": 0.88
    },
    {
      "id": "prop:wall-mid-l",
      "type": "prop",
      "name": "wall",
      "position": [-4.25, 1.1, 0.15],
      "yaw": 0.0,
      "model": "box",
      "scale": [5.8, 2.2, 0.4],
      "enabled": true,
      "color": [84, 78, 68],
      "roughness": 0.86
    },
    {
      "id": "prop:wall-mid-r",
      "type": "prop",
      "name": "wall",
      "position": [4.15, 1.1, 0.15],
      "yaw": 0.0,
      "model": "box",
      "scale": [6.0, 2.2, 0.4],
      "enabled": true,
      "color": [84, 78, 68],
      "roughness": 0.86
    },
    {
      "id": "prop:hide",
      "type": "prop",
      "name": "hide",
      "position": [-5.4, 0.55, 3.5],
      "yaw": 0.4,
      "model": "box",
      "gltf": "crate.glb",
      "scale": [1.5, 1.15, 1.4],
      "enabled": true,
      "color": [150, 112, 72],
      "roughness": 0.8
    },
    {
      "id": "prop:guard-a",
      "type": "prop",
      "name": "guard",
      "position": [-2.6, 0.02, -3.6],
      "yaw": 1.5708,
      "model": "box",
      "gltf": "knight",
      "scale": [1.0, 1.0, 1.0],
      "enabled": true,
      "color": [255, 255, 255]
    },
    {
      "id": "prop:guard-b",
      "type": "prop",
      "name": "guard",
      "position": [5.6, 0.02, 1.5],
      "yaw": 0.0,
      "model": "box",
      "gltf": "knight",
      "scale": [1.0, 1.0, 1.0],
      "enabled": true,
      "color": [255, 255, 255]
    },
    {
      "id": "prop:cone-a",
      "type": "prop",
      "name": "cone",
      "position": [3.4, 0.18, -3.6],
      "yaw": 1.5708,
      "pitch": 1.5708,
      "model": "cone",
      "scale": [9.7, 6.0, 0.55],
      "enabled": true,
      "parent": "prop:guard-a",
      "color": [232, 186, 48],
      "roughness": 0.7
    },
    {
      "id": "prop:cone-b",
      "type": "prop",
      "name": "cone",
      "position": [5.6, 0.18, 7.5],
      "yaw": 0.0,
      "pitch": 1.5708,
      "model": "cone",
      "scale": [9.7, 6.0, 0.55],
      "enabled": true,
      "parent": "prop:guard-b",
      "color": [232, 186, 48],
      "roughness": 0.7
    },
    {
      "id": "prop:patrol-a0",
      "type": "prop",
      "name": "patrol",
      "position": [-2.6, 0.05, -3.6],
      "model": "box",
      "scale": [0.15, 0.15, 0.15],
      "enabled": false,
      "parent": "prop:guard-a"
    },
    {
      "id": "prop:patrol-a1",
      "type": "prop",
      "name": "patrol",
      "position": [6.0, 0.05, -3.6],
      "model": "box",
      "scale": [0.15, 0.15, 0.15],
      "enabled": false,
      "parent": "prop:guard-a"
    },
    {
      "id": "prop:patrol-b0",
      "type": "prop",
      "name": "patrol",
      "position": [5.6, 0.05, 1.5],
      "model": "box",
      "scale": [0.15, 0.15, 0.15],
      "enabled": false,
      "parent": "prop:guard-b"
    },
    {
      "id": "prop:patrol-b1",
      "type": "prop",
      "name": "patrol",
      "position": [5.6, 0.05, 5.6],
      "model": "box",
      "scale": [0.15, 0.15, 0.15],
      "enabled": false,
      "parent": "prop:guard-b"
    },
    {
      "id": "prop:scan-a",
      "type": "prop",
      "name": "scan",
      "position": [0.0, 0.2, 0.4],
      "model": "box",
      "scale": [0.1, 0.1, 0.1],
      "enabled": false,
      "parent": "prop:guard-a"
    },
    {
      "id": "prop:scan-b",
      "type": "prop",
      "name": "scan",
      "position": [5.6, 0.2, 3.4],
      "model": "box",
      "scale": [0.1, 0.1, 0.1],
      "enabled": false,
      "parent": "prop:guard-b"
    },
    {
      "id": "prop:key",
      "type": "prop",
      "name": "key",
      "position": [-5.5, 0.4, 1.6],
      "yaw": 0.6,
      "model": "box",
      "gltf": "assets/library/kaykit/adventurers/assets/dagger.gltf",
      "scale": [1.15, 0.55, 1.15],
      "enabled": true,
      "color": [230, 190, 70],
      "metallic": 0.6,
      "roughness": 0.35
    },
    {
      "id": "prop:exit",
      "type": "prop",
      "name": "exit",
      "position": [-5.8, 0.22, -5.5],
      "yaw": 0.0,
      "model": "box",
      "gltf": "assets/library/kaykit/city-builder-bits/gltf/box_B.gltf",
      "scale": [1.7, 0.5, 1.6],
      "enabled": true,
      "color": [70, 180, 110],
      "roughness": 0.6
    },
    {
      "id": "prop:bush",
      "type": "prop",
      "name": "bush",
      "position": [6.2, 0.2, 6.1],
      "yaw": 0.3,
      "model": "box",
      "gltf": "assets/library/kaykit/city-builder-bits/gltf/bush.gltf",
      "scale": [1.2, 1.2, 1.2],
      "enabled": true
    },
    {
      "id": "prop:bench",
      "type": "prop",
      "name": "bench",
      "position": [2.6, 0.2, 5.9],
      "yaw": 1.57,
      "model": "box",
      "gltf": "assets/library/kaykit/city-builder-bits/gltf/bench.gltf",
      "scale": [1.0, 1.0, 1.0],
      "enabled": true
    },
    {
      "id": "prop:flag",
      "type": "prop",
      "name": "flag",
      "position": [6.2, 0.4, -6.2],
      "yaw": 0.0,
      "model": "box",
      "scale": [0.28, 0.9, 0.12],
      "enabled": false,
      "color": [80, 84, 78]
    }
  ],
  "walkers": [
    {
      "id": "walker:player",
      "type": "walker",
      "name": "player",
      "position": [0.2, 0.95, 5.5],
      "yaw": 3.14,
      "face": 3.14,
      "on_ground": true,
      "model": "rogue",
      "gltf": "rogue"
    }
  ],
  "lights": [
    {
      "id": "light:0",
      "type": "light",
      "name": "key",
      "position": [-1.2, 6.4, 2.4],
      "kind": "point",
      "slot": 0,
      "intensity": 1.35,
      "radius": 22.0,
      "color": [1.0, 0.92, 0.78]
    },
    {
      "id": "light:1",
      "type": "light",
      "name": "fill",
      "position": [4.5, 4.2, 6.0],
      "kind": "point",
      "slot": 1,
      "intensity": 0.45,
      "radius": 18.0,
      "color": [0.55, 0.68, 1.0]
    },
    {
      "id": "light:2",
      "type": "light",
      "name": "rim",
      "position": [-4.0, 3.6, -5.5],
      "kind": "point",
      "slot": 2,
      "intensity": 0.4,
      "radius": 16.0,
      "color": [0.75, 0.82, 1.0]
    },
    {
      "id": "light:3",
      "type": "light",
      "name": "bounce",
      "position": [0.4, 2.2, -1.0],
      "kind": "point",
      "slot": 3,
      "intensity": 0.32,
      "radius": 14.0,
      "color": [0.95, 0.78, 0.55]
    }
  ],
  "cameras": [
    {
      "id": "camera:main",
      "type": "camera",
      "name": "room",
      "position": [0.6, 15.5, 14.0],
      "target": [0.0, 0.0, -0.8],
      "fov": 46.0
    }
  ]
}
