{
  "version": 1,
  "genre": "town_gate",
  "half": 16.0,
  "floor_y": 0.0,
  "gravity": 9.8,
  "water_y": null,
  "coins": 20,
  "ground": false,
  "sky": [142, 186, 214, 255],
  "ibl": 0.42,
  "exposure": 1.05,
  "player": {
    "id": "walker:player",
    "type": "walker",
    "name": "hero",
    "position": [0.0, 0.95, -3.2],
    "yaw": 0.0,
    "face": 0.0,
    "on_ground": true,
    "model": "knight",
    "gltf": "knight"
  },
  "walkers": [
    {
      "id": "walker:player",
      "type": "walker",
      "name": "hero",
      "position": [0.0, 0.95, -3.2],
      "yaw": 0.0,
      "face": 0.0,
      "on_ground": true,
      "model": "knight",
      "gltf": "knight"
    },
    {
      "id": "walker:ally",
      "type": "walker",
      "name": "ally",
      "position": [-1.1, 0.95, -3.2],
      "yaw": 0.0,
      "face": 0.0,
      "on_ground": true,
      "model": "rogue",
      "gltf": "rogue"
    }
  ],
  "props": [
    {
      "id": "prop:floor",
      "type": "prop",
      "name": "floor",
      "position": [0.0, -0.06, 0.0],
      "yaw": 0.0,
      "model": "box",
      "gltf": null,
      "scale": [28.0, 0.12, 28.0],
      "enabled": true,
      "parent": null,
      "color": [96, 132, 78],
      "metallic": 0.02,
      "roughness": 0.86
    },
    {
      "id": "prop:village",
      "type": "prop",
      "name": "village",
      "position": [0.0, 0.35, -1.4],
      "yaw": 0.2,
      "model": "chest",
      "gltf": "chest",
      "scale": [0.7, 0.7, 0.7],
      "enabled": true,
      "parent": null,
      "color": [186, 140, 64],
      "metallic": 0.15,
      "roughness": 0.55
    },
    {
      "id": "prop:npc",
      "type": "prop",
      "name": "npc",
      "position": [0.2, 0.95, 2.4],
      "yaw": 3.14,
      "model": "mage",
      "gltf": "mage",
      "scale": [1.0, 1.0, 1.0],
      "enabled": true,
      "parent": null,
      "color": [180, 170, 220],
      "metallic": 0.05,
      "roughness": 0.6
    },
    {
      "id": "prop:shop",
      "type": "prop",
      "name": "shop",
      "position": [-5.2, 0.0, -0.4],
      "yaw": 1.2,
      "model": "inn",
      "gltf": "inn",
      "scale": [1.0, 1.0, 1.0],
      "enabled": true,
      "parent": null,
      "color": [210, 170, 120],
      "metallic": 0.04,
      "roughness": 0.72
    },
    {
      "id": "prop:enemy",
      "type": "prop",
      "name": "enemy",
      "position": [4.6, 0.95, 1.6],
      "yaw": -2.4,
      "model": "barbarian",
      "gltf": "barbarian",
      "scale": [1.0, 1.0, 1.0],
      "enabled": true,
      "parent": null,
      "color": [180, 80, 70],
      "metallic": 0.08,
      "roughness": 0.55
    },
    {
      "id": "prop:house",
      "type": "prop",
      "name": "house",
      "position": [-5.6, 0.0, 4.6],
      "yaw": 0.4,
      "model": "house",
      "gltf": "house",
      "scale": [2.4, 2.4, 2.4],
      "enabled": true,
      "parent": null,
      "color": [196, 160, 120],
      "metallic": 0.02,
      "roughness": 0.8
    },
    {
      "id": "prop:well",
      "type": "prop",
      "name": "well",
      "position": [3.2, 0.0, -3.8],
      "yaw": 0.0,
      "model": "well",
      "gltf": "well",
      "scale": [1.0, 1.0, 1.0],
      "enabled": true,
      "parent": null,
      "color": [170, 164, 150],
      "metallic": 0.05,
      "roughness": 0.7
    },
    {
      "id": "prop:tree-a",
      "type": "prop",
      "name": "tree",
      "position": [6.8, 0.0, -4.4],
      "yaw": 0.3,
      "model": "stylized_tree",
      "gltf": "stylized_tree",
      "scale": [0.7, 0.7, 0.7],
      "enabled": true,
      "parent": null,
      "color": [90, 140, 70],
      "metallic": 0.0,
      "roughness": 0.85
    },
    {
      "id": "prop:tree-b",
      "type": "prop",
      "name": "tree",
      "position": [-7.2, 0.0, 2.2],
      "yaw": 1.1,
      "model": "stylized_pine",
      "gltf": "stylized_pine",
      "scale": [0.65, 0.65, 0.65],
      "enabled": true,
      "parent": null,
      "color": [70, 120, 80],
      "metallic": 0.0,
      "roughness": 0.85
    },
    {
      "id": "prop:rock",
      "type": "prop",
      "name": "rock",
      "position": [6.4, 0.15, 3.6],
      "yaw": 0.6,
      "model": "rock",
      "gltf": "rock",
      "scale": [0.55, 0.4, 0.55],
      "enabled": true,
      "parent": null,
      "color": [140, 136, 128],
      "metallic": 0.02,
      "roughness": 0.9
    },
    {
      "id": "prop:potion",
      "type": "prop",
      "name": "potion",
      "position": [-3.5, 0.4, -0.2],
      "yaw": 0.0,
      "model": "chest",
      "gltf": "chest",
      "scale": [0.4, 0.4, 0.4],
      "enabled": false,
      "parent": null,
      "color": [210, 70, 80],
      "metallic": 0.2,
      "roughness": 0.4
    },
    {
      "id": "prop:stats",
      "type": "prop",
      "name": "stats",
      "position": [0.0, -1.0, 0.0],
      "yaw": 0.0,
      "model": "box",
      "gltf": null,
      "scale": [1.0, 0.0, 8.0],
      "enabled": false,
      "parent": null,
      "color": [40, 40, 48]
    },
    {
      "id": "prop:met",
      "type": "prop",
      "name": "met",
      "position": [0.55, 0.45, 2.4],
      "yaw": 0.0,
      "model": "box",
      "gltf": null,
      "scale": [0.22, 0.22, 0.22],
      "enabled": false,
      "parent": null,
      "color": [240, 196, 72]
    },
    {
      "id": "prop:hp-foe",
      "type": "prop",
      "name": "hp",
      "position": [4.6, 2.15, 1.6],
      "yaw": 0.0,
      "model": "box",
      "gltf": null,
      "scale": [0.35, 1.68, 0.35],
      "enabled": false,
      "parent": null,
      "color": [220, 70, 70]
    },
    {
      "id": "prop:overlay",
      "type": "prop",
      "name": "field",
      "position": [0.0, 0.2, 0.0],
      "yaw": 0.0,
      "model": "box",
      "gltf": null,
      "scale": [0.22, 0.22, 0.22],
      "enabled": true,
      "parent": null,
      "color": [40, 36, 52]
    }
  ],
  "lights": [
    {
      "id": "light:0",
      "type": "light",
      "name": "key",
      "position": [3.2, 6.4, -2.2],
      "kind": "point",
      "slot": 0,
      "intensity": 1.15,
      "radius": 18.0,
      "color": [1.0, 0.95, 0.86]
    },
    {
      "id": "light:1",
      "type": "light",
      "name": "fill",
      "position": [-4.0, 4.2, 3.0],
      "kind": "point",
      "slot": 1,
      "intensity": 0.55,
      "radius": 14.0,
      "color": [0.8, 0.88, 1.0]
    },
    {
      "id": "light:2",
      "type": "light",
      "name": "rim",
      "position": [0.4, 3.2, 6.5],
      "kind": "point",
      "slot": 2,
      "intensity": 0.4,
      "radius": 12.0,
      "color": [1.0, 0.9, 0.75]
    },
    {
      "id": "light:3",
      "type": "light",
      "name": "bounce",
      "position": [-1.5, 1.2, -4.0],
      "kind": "point",
      "slot": 3,
      "intensity": 0.28,
      "radius": 8.0,
      "color": [0.7, 0.85, 0.6]
    }
  ],
  "cameras": [
    {
      "id": "camera:main",
      "type": "camera",
      "name": "main",
      "position": [0.4, 6.8, -12.4],
      "target": [0.0, 1.2, 0.0],
      "fov": 50.0
    }
  ],
  "heightfield": null
}
