{
  "version": 1,
  "genre": "fps_range",
  "half": 18.0,
  "floor_y": 0.0,
  "gravity": 9.8,
  "water_y": null,
  "coins": 6,
  "ground": false,
  "sky": [
    156,
    196,
    228,
    255
  ],
  "ibl": 0.4,
  "exposure": 1.05,
  "player": {
    "id": "walker:player",
    "type": "walker",
    "name": "player",
    "position": [
      0.0,
      0.0,
      -2.0
    ],
    "yaw": 0.0,
    "face": 0.0,
    "on_ground": true,
    "model": "knight",
    "gltf": "knight"
  },
  "props": [
    {
      "id": "prop:floor",
      "type": "prop",
      "name": "floor",
      "position": [
        0.0,
        -0.1,
        0.0
      ],
      "yaw": 0.0,
      "model": "box",
      "gltf": null,
      "scale": [
        36.0,
        0.2,
        36.0
      ],
      "enabled": true,
      "parent": null,
      "color": [
        86,
        98,
        78
      ]
    },
    {
      "id": "prop:cover-a",
      "type": "prop",
      "name": "cover",
      "position": [
        -3.2,
        0.7,
        1.4
      ],
      "yaw": 0.2,
      "model": "box",
      "gltf": "crate.glb",
      "scale": [
        1.3,
        1.3,
        1.3
      ],
      "enabled": true,
      "parent": null,
      "color": [
        148,
        112,
        74
      ]
    },
    {
      "id": "prop:cover-b",
      "type": "prop",
      "name": "cover",
      "position": [
        3.4,
        0.65,
        -0.4
      ],
      "yaw": -0.4,
      "model": "box",
      "gltf": "crate.glb",
      "scale": [
        1.15,
        1.15,
        1.15
      ],
      "enabled": true,
      "parent": null,
      "color": [
        132,
        104,
        78
      ]
    },
    {
      "id": "prop:tree",
      "type": "prop",
      "name": "tree",
      "position": [
        -8.5,
        0.0,
        3.5
      ],
      "yaw": 0.4,
      "model": "stylized_tree",
      "gltf": "stylized_tree",
      "scale": [
        0.7,
        0.7,
        0.7
      ],
      "enabled": true,
      "parent": null,
      "color": [
        64,
        118,
        62
      ]
    },
    {
      "id": "prop:pine",
      "type": "prop",
      "name": "pine",
      "position": [
        8.2,
        0.0,
        2.2
      ],
      "yaw": -0.2,
      "model": "stylized_pine",
      "gltf": "stylized_pine",
      "scale": [
        0.62,
        0.62,
        0.62
      ],
      "enabled": true,
      "parent": null,
      "color": [
        46,
        92,
        68
      ]
    },
    {
      "id": "prop:rock",
      "type": "prop",
      "name": "rock",
      "position": [
        7.4,
        0.35,
        -6.2
      ],
      "yaw": 0.6,
      "model": "rock",
      "gltf": "rock",
      "scale": [
        0.55,
        0.4,
        0.55
      ],
      "enabled": true,
      "parent": null,
      "color": [
        140,
        136,
        128
      ]
    },
    {
      "id": "prop:well",
      "type": "prop",
      "name": "well",
      "position": [
        -7.6,
        0.0,
        -5.4
      ],
      "yaw": 0.3,
      "model": "well",
      "gltf": "well",
      "scale": [
        0.85,
        0.85,
        0.85
      ],
      "enabled": true,
      "parent": null,
      "color": [
        186,
        176,
        160
      ]
    }
  ],
  "walkers": [
    {
      "id": "walker:player",
      "type": "walker",
      "name": "player",
      "position": [
        0.0,
        0.0,
        -2.0
      ],
      "yaw": 0.0,
      "face": 0.0,
      "on_ground": true,
      "model": "knight",
      "gltf": "knight"
    },
    {
      "id": "walker:enemy:1:rogue",
      "type": "walker",
      "name": "enemy",
      "position": [
        0.2,
        0.0,
        8.2
      ],
      "yaw": 3.1416,
      "face": 3.1416,
      "on_ground": true,
      "model": "rogue",
      "gltf": "rogue"
    },
    {
      "id": "walker:enemy:1:barbarian",
      "type": "walker",
      "name": "enemy",
      "position": [
        5.6,
        0.0,
        6.4
      ],
      "yaw": 2.6,
      "face": 2.6,
      "on_ground": true,
      "model": "barbarian",
      "gltf": "barbarian"
    },
    {
      "id": "walker:enemy:2:mage",
      "type": "walker",
      "name": "reserve",
      "position": [
        -6.4,
        0.0,
        7.2
      ],
      "yaw": 2.4,
      "face": 2.4,
      "on_ground": true,
      "model": "mage",
      "gltf": "mage"
    },
    {
      "id": "walker:enemy:2:rogue",
      "type": "walker",
      "name": "reserve",
      "position": [
        7.2,
        0.0,
        -1.2
      ],
      "yaw": -1.6,
      "face": -1.6,
      "on_ground": true,
      "model": "rogue",
      "gltf": "rogue"
    },
    {
      "id": "walker:enemy:3:barbarian",
      "type": "walker",
      "name": "reserve",
      "position": [
        -6.8,
        0.0,
        -0.6
      ],
      "yaw": 1.2,
      "face": 1.2,
      "on_ground": true,
      "model": "barbarian",
      "gltf": "barbarian"
    },
    {
      "id": "walker:enemy:3:mage",
      "type": "walker",
      "name": "reserve",
      "position": [
        0.4,
        0.0,
        11.0
      ],
      "yaw": 3.1416,
      "face": 3.1416,
      "on_ground": true,
      "model": "mage",
      "gltf": "mage"
    },
    {
      "id": "walker:enemy:3:rogue",
      "type": "walker",
      "name": "reserve",
      "position": [
        -4.2,
        0.0,
        9.4
      ],
      "yaw": 2.8,
      "face": 2.8,
      "on_ground": true,
      "model": "rogue",
      "gltf": "rogue"
    }
  ],
  "lights": [
    {
      "id": "light:0",
      "type": "light",
      "name": "key",
      "position": [
        4.0,
        9.0,
        -6.0
      ],
      "kind": "point",
      "slot": 0,
      "intensity": 1.25,
      "radius": 32.0,
      "color": [
        1.0,
        0.95,
        0.86
      ],
      "direction": null
    },
    {
      "id": "light:1",
      "type": "light",
      "name": "fill",
      "position": [
        -8.0,
        5.5,
        6.0
      ],
      "kind": "point",
      "slot": 1,
      "intensity": 0.42,
      "radius": 24.0,
      "color": [
        0.62,
        0.74,
        1.0
      ],
      "direction": null
    }
  ],
  "cameras": [
    {
      "id": "camera:main",
      "type": "camera",
      "name": "main",
      "position": [
        1.6,
        4.6,
        -11.5
      ],
      "target": [
        0.6,
        1.3,
        3.0
      ],
      "fov": 52.0
    }
  ],
  "heightfield": null
}
